{
  "$schema": "../schemas/server.schema.json",
  "version": 1,
  "name": "paypal",
  "description": "PayPal: invoices, orders and payments (sandbox by default)",
  "category": "payments",
  "status": "beta",
  "launch": {
    "type": "remote",
    "url": "https://mcp.sandbox.paypal.com/mcp",
    "auth": {
      "type": "oauth"
    }
  },
  "variants": {
    "production": {
      "type": "remote",
      "url": "https://mcp.paypal.com/mcp",
      "auth": {
        "type": "oauth"
      }
    }
  },
  "secrets": [],
  "docs": "https://developer.paypal.com/ai-tools/mcp-server",
  "notes": ["Uses the PayPal **sandbox** by default. `--variant production` targets live payments (high risk)."],
  "prereqs": ["npx"],
  "guide": "docs/servers/catalog.md#paypal",
  "lastVerified": "2026-09-25"
}
