{
  "$schema": "../schemas/server.schema.json",
  "version": 1,
  "name": "azure-devops",
  "description": "Azure DevOps: work items, repos, pipelines and wikis",
  "category": "code-hosting",
  "launch": {
    "type": "stdio",
    "command": "npx",
    "args": ["-y", "@azure-devops/mcp@2.10.0", "${AZURE_DEVOPS_ORG}"]
  },
  "secrets": [
    {
      "key": "AZURE_DEVOPS_ORG",
      "required": true,
      "description": "Your organization name (the part after dev.azure.com/)",
      "help": "Open https://dev.azure.com and copy the name after dev.azure.com/ in the address bar. No organization yet? https://learn.microsoft.com/en-us/azure/devops/organizations/accounts/create-organization"
    }
  ],
  "prereqs": ["npx"],
  "docs": "https://github.com/microsoft/azure-devops-mcp",
  "notes": ["Signs in through the browser (Microsoft Entra) on first use. Can create and update work items, repos and wikis."],
  "guide": "docs/servers/catalog.md#azure-devops",
  "lastVerified": "2026-09-25",
  "status": "stable"
}
